{
  "protocol_version": "0.1",
  "schema": "localize-anything-knowledge-eligibility-report-v1",
  "artifact": "knowledge-eligibility-report.json",
  "status": "pass",
  "selection_artifact": "knowledge-pack-selection.json",
  "source_locale": "en-US",
  "target_locale": "zh-CN",
  "domains": ["institutional_publicity"],
  "scenario": "institutional_publicity_case",
  "operating_mode": "greenfield_localization",
  "entries": [
    {
      "knowledge_id": "knowledge-term-001",
      "pack_id": "institutional-zh-cn",
      "pack_path": ".localize-anything/knowledge/packs/institutional-zh-cn",
      "knowledge_type": "term",
      "source_artifact": "term-registry.csv",
      "source_value": "Open Lab",
      "target_value": "开放实验室",
      "status": "locked",
      "scope": "institutional_publicity_case",
      "classification": "hard_constraint",
      "reasons": ["approved_scoped_term"],
      "provenance_id": "knowledge-candidate-001",
      "provenance": {"source_artifact_references": ["term-decisions.jsonl"]},
      "priority": "official",
      "source_locale": "en-US",
      "target_locale": "zh-CN"
    }
  ],
  "summary": {"entry_count": 1, "hard_constraint_count": 1, "soft_context_count": 0, "reference_only_count": 0, "negative_constraint_count": 0, "review_required_count": 0, "not_eligible_count": 0, "stale_count": 0, "scope_mismatch_count": 0, "rejected_count": 0},
  "source_artifact_references": ["term-registry.csv"]
}
